New Code,OP
OP496,Define monitoring activities to comply with privacy requirements  
OP497,Monitor for new or amended privacy laws and regulations 
OP498,Define review trigger based on new or amended privacy laws and regulations
OP499,Update enterprise privacy policies to align with new or amended laws and regulations
OP500,Communicate modified enterprise privacy policies to relevant stakeholders
OP501,Monitor internal compliance to privacy requirements
OP502,Demonstrate compliance with privacy regulations
OP2366,Demonstrate project compliance with privacy regulations
OP2367,Monitor project compliance to privacy laws and regulations
OP503,Demonstrate compliance with accountability principle (GDPR)
OP504,Monitor vendors and service providers' compliance
OP505,Periodically perform a privacy compliance audit
OP506,Escalate non-compliance / violation of privacy policies
OP507,Identify remediation plan for non-compliance/violation
OP508,Monitor remediation plans for non-compliance/violation
OP509,Demonstrate of remediation of non-compliance/violation
OP510,Define organizational privacy strategy  
OP511,Identify and engage privacy stakeholders and internal partnerships
OP512,"Provide access to and communicate privacy mission and vision statement, policies, directives and code of conduct"
OP2813,Communicate the legal and admisntrative consequences of non compliance to privacy practices guidelines
OP2837,Communicate compliance requirements to internal stakeholders
OP513,"Train personnel on required practices related to PI collection, use, handling, access, retention, and disclosure"
OP515,Attest that privacy training has been provided
OP516,Attest personnel understanding and agreement to comply to privacy requirements
OP517,Train personnel to identify and report non-compliance with privacy policies
OP518,Train personnel for management of privacy breach
OP2382,Train project team for prevention and response to privacy breaches
OP519,Attest personnel understanding of privacy breach requirements
OP520,Attest that privacy breach training has been provided
OP521,Define roles and responsibilities for inquiries related to privacy practices
OP522,Communicate privacy roles & responsibilities to personnel
OP523,Train project team on compliance with legal requirements
OP524,Train project team on data subject rights
OP525,Monitor personnel training on data subject inquiries
OP2593,Designate point of contact to assist individuals understand consent requirements
OP526,Identify consent obligations and requirements (project)
OP527,Prohibit mandatory consent for provision of product/service
OP528,Demonstrate that mandatory consent is reasonable
OP529,Define enterprise consent policy and guidelines 
OP530,Establish a process to collect consent for each specific and new use of personal information
OP531,Select consent type appropriate for identified purposes 
OP532,Develop consent forms and enterprise privacy notice templates
OP2395,Define consent form specific to intended purposes of project
OP533,Communicate data collection purposes to data subjects
OP2397,Design and implement mechanisms to collect consent
OP535,Collect consent for disclosing personal data to third-party
OP536,Collect consent for new processing purposes
OP537,Attest that consent is being collected for each identified purpose
OP538,"Demonstrate express consent for collecting, processing and disclosing sensitive data"
OP539,Assist data subject to understand consent scope
OP2814,"Collect consent for personal information collection, processing or disposal"
OP2591,Develop consent forms and privacy notice templates for the collection of personal information from parents and guardians of minors
OP2592,Establish a process to collect consent for the use of personal information of minors
OP541,Obtain parental/guardian authority consent to use personal information of minors
OP542,Verify whether child consent is given by holder of parental/guardian responsibility
OP543,Attest that consent is not collected from a child 
OP544,Attest that child consent is obtained from a valid representative
OP546,Communicate to data subjects their right to withdraw consent from PI use
OP547,Design and implement mechanisms for withdrawal of consent
OP1888,Attest that consent withdrawal is managed
OP549,Audit consent processes
OP550,Monitor transparent collection purpose
OP551,Record legal basis for consent
OP1883,Approve the Consent strategy (project)
OP1884,Attest that privacy notice was provided to data subject 
OP1885,Attest that data subject can restrict processing
OP1886,Attest that data subject can opt out from automated decision
OP1887,Attest that data subjects are informed of automated decision
OP1889,Attest that right to be forgotten is managed in context
OP1890,Attest that data subject is informed of AI usage
OP553,Define guidelines and procedures to receive and process data subject requests
OP554,Define roles and responsibilities for the processing of data subject requests
OP555,Define communication procedures and messages in response to data subject requests 
OP556,Define recording procedures of the processing of data subject requests
OP557,Establish submission methods for data subject requests
OP2368,Assess the impacts of data subject requests on developed solutions
OP2369,Strategize and plan project activities related to data subject requests
OP558,Define the identity assurance level requirements for data subject requests
OP559,Define identity verification procedures
OP2809,Communicate receipt of personal information request
OP560,Provide support in preparing a request to the organization
OP561,Receive / Detect data subject request
OP562,Verify data subject identity upon receiving request
OP563,Assess the legal grounds to accept/deny data subject requests
OP564,Assess sensitivity of personal information subject to data subject request
OP565,Review and approve request refusal 
OP566,Record enterprise decisions regarding data subject request
OP567,Confirm that the data subject request was processed successfully
OP568,Communicate enterprise decision regarding data subject request
OP569,Operationalize processing of data subject requests
OP570,Track data subject request response times
OP571,Review identity verification procedures & requirements
OP572,Review communication procedures and messages to data subject 
OP573,Review obligations regarding data subject requests periodically
OP574,Define Privacy Notice (enterprise)  
OP575,Approve the Privacy Notice
OP576,Publish Privacy Notice on website
OP577,Update Privacy Notice
OP2626,Define Privacy Notice (project)  
OP578,Communicate Privacy Notice to data subjects
OP579,Communicate privacy rights to data subjects
OP580,Communicate request submission methods
OP581,Establish a process to obtain consent for the use of personal information at the source of collection
OP582,Communicate personal information processing purposes
OP583,Communicate collection methods to data subjects
OP584,Communicate categories of personal information collected
OP585,Communicate the sources from which personal information is collected
OP586,Communicate new personal information processing purposes
OP587,Communicate categories of personal information collected from third parties
OP588,Communicate commercial purposes for personal information collection
OP589,Communicate personal information retention schedule
OP590,Communicate use of technology for personal information processing
OP591,Communicate categories of third parties to whom personal information will be disclosed
OP592,Communicate foreseeable consequences of personal information processing
OP593,Communicate (automated) decision
OP599,Communicate the potential consequences of automated processing for data subject
OP4013,Inform affected individuals about the process to rectify the personal information used to render a decision 
OP4014,Provide privacy notice and policies to individuals at the source of collection 
OP4015,"Provide privacy notice related to the use of technology that can identify, locate or profile individuals"
OP4016,Provide privacy notice related to the use of automated decision-making at the time of decision-making
OP4017,Provide privacy notice and information related to privacy policies to affected individuals 
OP4018,Provide the designated point of contact to assist individuals to understand consent requirements
OP4019,"Establish capabilities to provide reasons, principal factors and parameters that led to an automated decision to affected individuals"
OP4010,Provide the designated point of contact for inquiries related to the use of automated decision-making systems
OP4011,Provide the designated point of contact to request access or modifications to personal information
OP4008,"Designate point of contact to manage requests to access, delete or modify personal information"
OP4009,Develop privacy impact assessment guidelines and templates
OP4020,Develop data sharing agreement guidelines and templates
OP4012,Provide details on the use of automated decision-making systems to render a decision  
OP2805,Disclose to applicant that the unfavorable decision is based on consultation of financial reports
OP600,Define project strategy to restrict personal information processing
OP601,Implement procedures to restrict personal information processing
OP602,Demonstrate that PI processing is restricted
OP603,Communicate PI restriction/unrestriction to data subjects
OP604,Establish mechanisms to stop PI processing following objection
OP2372,Implement mechanisms to stop personal information processing following objection
OP605,Cease personal information processing as requested by data subject
OP606,Cease personal information processing for marketing purposes
OP607,Define the position regarding AI opt-out option  
OP608,Establish an AI opt-out mechanism for data subjects
OP609,Establish procedures to receive & process requests to opt-out
OP610,Communicate opt-out option to data subjects concerning the use of AI
OP612,Monitor requests to opt-out from AI usage
OP613,Establish an automated decision opt-out mechanism for data subjects
OP614,Define procedures to intervene in automated decision-making process
OP615,Communicate opt-out option to data subjects concerning decisions based on automated processing
OP616,Remove data subjects from automated decision-making
OP617,Attest that decision is not based solely on automated processing
OP618,Monitor requests to opt-out from automated decision-making
OP619,Periodically review opt-out processes 
OP594,Define notification message for data subjects following decision based on automated processing  
OP595,Communicate rendered decision based on automated personal information processing
OP2705,Designate a point of contact for all inquiries related to the use of automated decisions
OP1835,Define procedures to process requests concerning automated decisions
OP596,Communicate personal information used to render decision to data subject
OP597,"Communicate reasons, principal factors, and parameters that led to decision to data subject"
OP598,Communicate the right to rectification of personal information used to render decision
OP620,Define guidelines to assess and monitor the quality of personal information
OP621,Identify inaccurate personal information
OP622,Correct or erase inaccurate personal information
OP623,Record that inaccurate personal information is corrected or erased
OP624,Define procedures and mechanisms to rectify personal information
OP2379,Implement mechanisms to rectify personal information
OP625,Rectify personal information as requested by data subject
OP626,Record that personal information has been rectified
OP627,Transmit rectified personal information to stakeholders
OP628,Communicate rectified PI to third party to which the PI had been disclosed
OP2703,Establish a procedure to receive and process requests to access personal information
OP2704,"Establish a process to communicate the requirements related to the release, modification, or deletion of personal information"
OP629,Define formats to provide personal information to data subjects
OP630,Establish enterprise procedures to retrieve and transfer personal information
OP631,Communicate personal information existence to data subject
OP632,Communicate the cost for access to personal information
OP633,Transmit personal information copy to data subject
OP634,Transmit personal information in alternative format to data subject
OP1821,Define roles and responsibilities for data portability requests
OP635,Establish interoperable formats for data portability
OP1819,Identify portable data scope
OP1820,Establish procedures to extract portable data from systems
OP2570,Design and implement mechanisms to locate and retrieve personal information from systems
OP636,Establish procedures to transfer portable data to data subjects
OP1822,Train personnel for data portability request processing
OP1823,Test data portability process
OP1824,Extract portable data concerning specific data subject
OP1825,Format personal information for data portability
OP1826,Validate personal information to be transferred for portability request
OP637,Transmit personal information for data portability
OP638,Attest the compliance to data portability request
OP1827,Define roles and responsibilities for requests to be forgotten
OP1828,Define personal information exemption list for requests to be forgotten  
OP639,Define procedures to erase personal information
OP2371,Implement mechanisms to erase personal information
OP643,Define procedures to cease dissemination of personal information
OP646,Define procedures to dereference personal information
OP1829,Train personnel for requests to be forgotten
OP1830,Test personal information erasure procedures
OP1836,Identify personal information subject to erasure request
OP1831,Assess whether personal information can be erased
OP640,Erase personal information as requested by data subject
OP641,Confirm personal information erasure to data subject
OP642,Record that erasure of personal information has been performed
OP1832,Identify personal information subject to request to cease dissemination
OP1833,Assess whether personal information dissemination can be ceased
OP1834,Tag personal information subject to request to cease dissemination
OP644,Cease personal information dissemination
OP645,"Store personal information in ""Do not disseminate"" system"
OP647,De-reference personal information
OP648,Record that personal information is de-referenced
OP649,Communicate erasure requests to third parties to which PI has been disclosed
OP650,Demonstrate transmission of erasure request to third parties
OP651,Communicate erasure request refusal to data subject
OP652,Demonstrate that erasure refusal is permitted by law
OP653,Define guidelines for refusing rectification requests
OP654,Communicate rectification request refusal
OP655,Record substance of unresolved rectification challenge 
OP656,Retain personal information subject to denied rectification request
OP657,Define communication requirement and guidelines for refusal of individual access to PI
OP658,Communicate access/rectification request refusal
OP659,Retain personal information subject to refused access request
OP660,Provide support to understand access request refusal
OP661,Define guidelines for refusing restriction requests
OP662,Refuse request to restrict personal information processing
OP663,Demonstrate that continued processing of PI subject to objection is lawful
OP665,Designate accountable individual for complaint management
OP666,Establish complaint procedures for data subjects
OP667,Establish procedures to receive and process data subject complaints
OP668,Communicate complaint procedures to data subjects
OP669,Investigate data subject complaints
OP670,Amend privacy policies and practices following a complaint
OP671,Monitor complaints related to personal information processing
OP672,Define enterprise guidelines related to decision challenges
OP673,Authorize challenge of decision for clients
OP664,Record disagreements between organization and individuals on PI amendments
OP674,Define enterprise guidelines and procedures to collect personal information 
OP675,Define enterprise guidelines and procedures to document personal information collection purposes
OP676,Define enterprise guidelines and procedures to handle and process personal information 
OP677,Define enterprise guidelines and procedures to process special categories of data
OP678,Define enterprise guidelines and procedures to process data related to criminal convictions
OP679,Define enterprise guidelines and procedures to ensure lawful disclosure of personal information
OP680,Define guidelines and procedures to allow transfer of PI to a third party
OP681,Define enterprise guidelines and procedures to retain personal information
OP682,Define enterprise guidelines and procedures to destroy personal information
OP683,Define enterprise guidelines and procedures to anonymize personal information
OP684,Define enterprise guidelines and procedures to cross-link/combine data sets containing personal information
OP685,Approve the enterprise guidelines and procedures related to personal information
OP686,Assign roles and responsibilities for managing personal information across its lifecycle
OP687,Establish training about enterprise guidelines and procedures for handling personal information
OP688,Communicate personal information management directives to relevant stakeholders
OP2629,Define guidelines and procedures for accessing personal information
OP2818,Communicate to internal stakeholders activities or programs involving the use of PI in a decision process
OP2821,"Establish monitoring mechanism for access , use or disclosure of PI"
OP1691,Establish guidelines for personal information processing for web analytics
OP1699,Draft Web analytics section for Privacy Notice
OP1692,Limit personal information processing to Web analytics purposes
OP1725,Prohibit profiling with personal information collected for Web analytics
OP1727,Establish retention schedule for IP addresses
OP1695,De-identify personal information prior to transfer and/or processing
OP1726,Establish contractual requirements for transfer of personal information used for Web analytics
OP1696,Approve the third-party depersonalization techniques
OP1728,Monitor personal information processing for Web analytics
OP689,Identify in-scope requirements related to processing purposes
OP690,Enterprises define acceptable processing purposes for collecting personal information
OP691,Identify personal information necessary for processing purpose
OP692,Approve the personal information to be collected for specified processing purposes
OP693,Define processing purpose prior to collecting personal information
OP694,Approve the processing purpose prior to collecting personal information
OP695,Define new purpose for processing personal information  
OP696,Approve the new processing purpose prior to the processing of personal information
OP697,Verify that processing purpose is compatible with enterprise legal obligations and position
OP698,Review personal information required to fulfill purposes when new purposes are approved
OP699,Define guidelines and procedures to limit collection of personal information to approved purposes
OP700,Obtain agreement from authorities to collect personal information
OP701,Limit personal information collection to processing purposes
OP1881,Attest that the collection of personal information is limited to approved purposes
OP2797,Attest that only the necessary personal information is collected
OP2835,Validate legal authority for the collection of PI
OP702,Define enterprise guidelines on the granularity of PI
OP703,Justify usage of high granularity personal information
OP704,Evaluate alternative data of lower granularity
OP705,Define lower granularity alternatives for personal information
OP1880,Approve the personal information collection and usage
OP706,Provide personal information collection purposes to third-party
OP707,Attest that personal information collected by third party is limited to what is necessary for specified purposes
OP708,Attest that consent was obtained for third-party personal information collection
OP709,Record source of personal information collection
OP2798,Attest that unconsented data collection from a third-party is lawful
OP710,Attest that personal information disclosure is not mandatory for data subjects
OP711,Attest that mandatory personal information collection is permitted by law
OP2804,Determine the requirements for personal information collection specific to a request for goods or services
OP712,Define guidelines and procedures to limit usage of personal information to approved purposes
OP713,Attest that the processing of personal information is limited to approved purposes
OP2800,Monitor compliance to guidelines on limiting usage of personal information to approved purposes
OP714,Define guidelines for personal information processing without consent
OP715,Approve the personal information processing without consent
OP716,Record personal information processing without consent
OP717,Define guidelines and procedures to update personal information
OP718,Identify personal information update requirements
OP719,Create a personal information update schedule
OP720,Update personal information
OP721,Record personal information updates
OP722,Define guidelines and procedures to limit disclosure of personal information to approved purposes
OP723,Record personal information disclosure recipients
OP724,Monitor compliance to guidelines on information disclosure
OP725,Attest that required consent is obtained when disclosing personal information
OP726,Provide access to unconsented disclosure register
OP727,Attest that disclosure of PI is necessary to fulfill intended purposes
OP728,Communicate the personal information disclosure recipients
OP729,Communicate categories of PI that have been disclosed
OP730,Communicate the safeguards used for the PI transfer to data subjects
OP2707,Complete written agreement for release of personal information for study or research purposes
OP2598,Ensure all written agreements are sent to the Commissioner
OP731,Define guidelines for personal information disclosures without consent
OP732,Approve the personal information disclosures without consent
OP733,Record unconsented personal information disclosure
OP734,Review unconsented personal information disclosures periodically
OP735,Define guidelines and procedures to transfer personal information
OP736,Define security safeguards for personal information transfers
OP737,Define standard data transfer format
OP738,Draft contract for personal information transfers to third parties
OP739,Communicate enterprise policies & applicable regulations to third party
OP740,Approve the contract for personal information transfers to third parties
OP741,Attest signed contract for personal information transfer
OP742,Audit third party compliance periodically
OP743,Attest that third party is compliant to personal information transfer contract
OP2836,Complete written agreement for transferring control of personal information to a third party
OP744,Implement PI data transfer between parties SLA
OP745,"Define, approve, and review PI data transfer SLA"
OP746,"Review, update, and attest SLA validity"
OP747,Design technical mechanisms to extract personal information from systems
OP748,Extract personal information for portability request
OP749,Obtain agreement (from authorities) to release personal information
OP750,Define roles and responsibilities for international PI transfer oversight
OP751,Assess whether PI transfer is outside the geographical scope of regulation
OP752,Assess whether PI is necessary to fulfill transfer purposes
OP753,Assess whether adequacy decision applies to transfer
OP754,Assess whether appropriate safeguards are implemented for PI transfer
OP755,Assess whether exception applies to transfer
OP756,International transfer of personal information
OP757,Demonstrate lawful international PI transfer
OP758,Attest that standard data transfer format usage is used
OP4001,Provide contact information of the designated individuals responsible for the protection of personal information to the Commissioner
OP4002,Create a register of confidentiality incidents to log breaches and measures taken
OP759,Assess privacy-related factors before disclosing personal information
OP760,Assess sensitivity of information to be disclosed
OP761,Assess purposes for which PI is to be used once disclosed
OP762,Assess protection measures that will be applied to PI once disclosed
OP763,Assess the applicable legal framework in the state where PI is to be disclosed
OP4003,Complete written agreement for release of personal information without consent of the person concerned
OP4004,Conduct privacy impact assessment for the release of personal information without consent of the person concerned
OP4005,Complete written agreement for release of personal information outside of Quebec
OP2706,Conduct privacy impact assessment for personal information used for study or research purposes without consent of the person concerned
OP2594,Conduct privacy impact assessment for personal information collected as part of a survey
OP4006,Conduct privacy impact assessment for the release of personal information outside of Quebec
OP4007,Conduct privacy impact assessment for technology applications that use personal information
OP764,Assess privacy-related factors before disclosing PI without consent
