New Code,OP
OP1920,Define data management strategy
OP2026,Obtain mandate to develop DMS
OP2027,Create a DMS team
OP2028,Identify DMS stakeholders
OP1922,Review and approve DMS by stakeholders
OP2029,Create a DMS socialization strategy
OP1923,Evaluate the enforceability of DMS
OP1924,Document high-level business requirements / use Cases
OP1925,Prioritize business requirements / use cases
OP2030,Define mecanisms for DMS alignment with organizational changes
OP1926,Define DM business case
OP1927,Define expected DM outcomes and targets
OP2031,Define DMS expected benefits and KPIs
OP2032,Identify risks associated with not having a DMS
OP1928,Review and approve DM business case
OP1929,Define data content strategy
OP1921,Review external sources for business requirements
OP2034,Assess the current state of DM initiatives
OP2035,Define gap closure roadmap
OP1931,Define data management deployment strategy
OP2036,Review and approve data management deployment strategy
OP1974,Define a DM policy and standards
OP1975,Review and approve DM policy and standards
OP1976,Audit adherence to DM policy and standards
OP1944,Establish the Office of Data Management (ODM)
OP2451,Establish data management processes for the context of the project
OP1932,Define DMP strategy and approach
OP2037,Review and approve DMP strategy and approach
OP2038,Define roles and responsibilities of the DMP function
OP2039,Define policies and procedures to enforce DMP compliance  
OP2040,Establish Project Management Office (PMO)
OP1933,Define formal DMP processes
OP1934,Integrate DMP concepts in DMS
OP1930,Define data usage strategy
OP2676,Define roles and responsibilities specific to managing data and information throughout its lifecycle
OP2033,Review data usage strategy for ethical considerations
OP2229,Document intended usage of data
OP2230,Identify and evaluate restrictions on data usage
OP2231,Document data usage restrictions
OP2227,Validate that data collection and/or usage is aligned with legitimate purpose
OP2713,Implement processes and technologies to ensure that data is collected and used in accordance with applicable laws and regulations
OP1935,Define program roadmaps aligned with DMS
OP1936,Review and approve program roadmaps
OP1937,"Develop project plans detailing deliverables, timelines, and milestones"
OP2041,Review and approve project plans
OP1939,Adopt a process optimization framework
OP1938,Define standard DM processes
OP2042,Assess quality control within DM process
OP2043,Monitor quality assurance of DM process
OP1940,Audit DM processes
OP2044,Establish formal DM training programs
OP1941,Define program metrics to track progress
OP2045,Review and approve program metrics
OP2046,Report program metrics to track progress
OP1942,Define outcome metrics to track against business objectives  
OP2047,Review and approve outcome metrics
OP2048,Report outcome metrics against business objectives
OP1943,Define process metrics to drive continuous improvement
OP2049,Review and approve process metrics
OP2050,Report process metrics
OP2988,"Establish an approved Enterprise Information Management solution for documenting business activities, decisions, and processes"
OP2989,Establish a mechanism for tracking and reporting on adoption and usage of the Enterprise Information Management solution
OP2990,Develop a training plan to ensure users are properly trained on the Enterprise Information Management System
OP1988,Establish a data control environment
OP1989,Define DM stakeholder roles & responsibilities
OP1990,Demonstrate DM capabilities alignment across organization
OP1991,Demonstrate alignment between control function and DM policy and standards
OP1992,Monitor collaboration between DM control functions
OP1993,Apply controls to data entering/exiting the ecosystem
OP1997,Define analytics strategy and approach
OP1999,Define analytics operating model
OP2000,Establish an analytics funding model
OP1998,Define analytics categorization and use-cases terminology
OP2003,Identification of dependencies between analytics and business architecture
OP2004,Align the Analytics roadmap with the business strategy
OP2005,Measure and report analytics initiative impact 
OP2012,Design platform suitable for Analytics operating model
OP2013,Establish an analytics version control regime
OP2014,Define and implement data obfuscation strategies
OP2015,Define environment scalability requirements
OP2560,Establish quality requirements for automated model development processes
OP1615,Establish a statement of purpose for model development
OP2351,Establish experiment tracking and documentation processes
OP1616,"Document model design, theory and logic"
OP1617,Document model methodologies and processing components
OP2568,Conduct an assessment of potential impact to the planet
OP2352,Record and track experimentation results
OP1618,Compare model development with alternative theories
OP1619,Demonstrate sound model development
OP2280,Define appropriate data sampling techniques
OP2308,Establish representative sample data population
OP2309,Validate data sample representativeness
OP2310,Identify target data population characteristics
OP2311,Validate target data population characteristics
OP2244,"Document ""In the lab"" model testing requirements"
OP2563,"Assess ""In the Field"" testing requirements"
OP1624,"Define ""In the Lab"" model testing procedures"
OP2564,"Define ""In the Field"" model testing procedures"
OP1625,Assess model accuracy
OP2578,Evaluate the integration testing of the model
OP2579,Evaluate challenger models prior to deployment
OP2245,Document type / purpose of test
OP2246,Document datasets used for modeling and testing
OP2565,"Document datasets used for ""In the Field"" testing"
OP2247,Document model parameters
OP2248,Document testing conditions
OP2338,Document model dependencies
OP1627,Evaluate the model behavior over various conditions
OP1628,Assess the impacts of model assumptions
OP1629,Evaluate the model impacts on other models
OP2567,Evaluate the impact of model changes/updates on other models
OP1630,Assess model performance by model users
OP2548,Examine UI/UX for deceptive design patterns  
OP2549,Conduct a user evaluation of the UI/UX
OP1912,Assess AI system performance
OP2249,Evaluate and document testing outcomes
OP1631,Demonstrate model robustness and stability
OP1632,Establish model report guidelines
OP1633,Assess model uncertainty and inaccuracy
OP1634,Define measures to account for model uncertainty and inaccuracy
OP2566,Monitor and enforce measures that account for model uncertainty and inaccuracy
OP1635,Adjust model components to reduce uncertainty and inaccuracy
OP2271,Establish model deployment structure
OP2272,Establish model deployment strategy
OP2273,Establish model monitoring strategy and processes
OP2274,Validate complete model deployment
OP1636,Define the model conservatism
OP1637,Document conservative model procedures
OP1638,Establish limits on model usage
OP1639,Train model users for conservatism
OP1640,Demonstrate model conservatism
OP1643,Define model validation process  
OP1644,Assign roles & responsibilities for model validation
OP1646,Train personnel for model validation
OP1647,Establish incentives for model validation
OP1648,Identify model components requiring validation
OP1649,Establish periodic model review
OP1645,Review model validation by independent party
OP1682,Record model validation
OP2279,Establish data requirements for fairness testing
OP2281,Define data requirements for robustness testing
OP2282,Establish exploratory data analysis processes / requirements
OP2335,Document model's limitations
OP2254,Assess model scalability and/or technical requirements
OP2258,Establish required AI literacy level
OP2255,Determine ethical considerations that limit model usage
OP2256,Determine business considerations that limit model usage
OP2257,Determine model transparency and explainability capabilities
OP1626,Assess model limitations
OP1656,Identify model performance boundaries 
OP159,Establish model security requirements
OP1650,Evaluate the model developmental evidence
OP1651,Assess model assumptions and variable choice
OP1652,Assess data used in model development
OP1653,Evaluate the logic and judgment used in model development
OP1654,Analyze model sensitivity
OP1655,Conduct model stress testing
OP2339,Establish model lifecycle's monitoring strategy
OP2340,Establish requirements and processes appropriate to the context of the project monitoring
OP2341,Establish monitoring and control points for the Model Development/Testing processes
OP2342,Establish monitoring and control points for the Model Validation/Selection processes
OP2343,Establish monitoring and control points for the Model Risk Assessment processes
OP2344,Establish monitoring and control points for data quality assurance and data selection processes
OP2345,Establish monitoring and control points for performance assessment of the model in production
OP1657,Establish ongoing testing & evaluation program
OP1658,Define ongoing monitoring practices  
OP1659,Define response procedures for model problems
OP1660,Assess model limitations periodically
OP1661,Analyze model overrides periodically
OP1662,Track model override performance
OP1915,Integrate logging capabilities into the AI system
OP1663,Escalate model revision needs
OP1906,Document corrective actions taken
OP2334,Audit data and model inputs
OP1908,Conduct model process verification
OP1664,Verify data inputs quality
OP1665,Verify model computer code
OP1666,Verify system integration
OP1667,Verify user-developed applications
OP1668,Review model-derived reports
OP1670,Define model benchmarking data
OP1671,Model benchmarking
OP1672,Analyze benchmarking results
OP1673,Investigate benchmarking discrepancies
OP1909,Conduct outcomes analysis
OP1674,Define outcomes analysis techniques  
OP1675,Define outcomes analysis metrics  
OP1676,Establish early warning metrics for outcomes analysis
OP1677,Define escalation procedures for model deficiencies
OP2632,Document escalated model deficiencies
OP1678,Conduct parallel outcomes analysis
OP1679,Identify necessary model changes
OP1680,Conduct model back-testing
OP1681,Analyze model discrepancies
OP2329,Define procedures to determine and specify decision control points
OP2330,Define decision control points appropriate to the context of the project
OP2331,Validate decision control points
OP2332,Implement the decision control points
OP1816,Define procedures to document automated model decisions
OP1804,Document model decisions
OP2574,Disclose the level of Functional Correctness along with decision
OP2562,Monitor and validate appropriateness of AI system's decisions and/or outputs
OP2328,Audit the AI system’s decisions and/or outputs periodically
OP2333,Audit decision control points periodically
OP1420,Define Model Metadata Practice
OP1421,Define and approve PL attribute for Ms attestation
OP2586,Document the design and functionality of the AI system
OP1422,Produce model factsheets and model cards
OP1434,Approve the model before production
OP1817,Approve the deployment of the Automated Decision System in production
OP1436,"Diversify datasets for testing, training & validating"
OP1437,Test AI models on various demographic groups to mitigate systematic bias
OP1438,Assess training dataset generalizability
OP1439,Document data used to train machine learning models
OP1441,Define features to incorporate in AI models
OP1442,Define robustness requirements of AI models
OP1443,Conduct adversarial testing on AI models
OP2288,Evaluate the impact of data quality on model performance
OP2289,Evaluate adversarial attack impact on model performance
OP2546,Conduct application security testing
OP2547,Conduct red-team exercise
OP2290,Evaluate the impact of resource degradation on model performance
OP2573,Set up additional safety features for known critical issues
OP2337,Document model robustness evaluation
OP1444,Conduct periodic audit of robustness of AI model
OP1910,Validate AI model robustness
OP1445,Approve outliers patterns and thresholds
OP1446,Detect new outlier patterns and thresholds
OP1447,Approve new data quality criteria
OP1448,Evaluate the risk appetite on a regular basis
OP1449,Manage breaks in statistical properties
OP1450,Manage duration of data relevance
OP1451,Manage outliers patterns & thresholds
OP1452,Define data quality criteria
OP1453,Detect and approve new outlier patterns
OP1911,Define acceptable levels of model and data drift
OP2318,Establish mechanisms and processes to mitigate data drift
OP2319,Establish mechanisms and processes to retrain model
OP1454,Attest model robustness to data drift
OP1455,Attest that models trained on time-sensitive data remain relevant
OP1916,Reinforce vulnerable soft AI assets
OP1917,Implement intrusion and attack formulation detection system
OP1918,Create attack response plans
OP1919,Create a rapid vulnerability mapping
OP1456,Repel data evasion attacks
OP1457,Repel data poisoning attacks
OP1458,Enforce model hardening
OP1459,Enforce run-time-detection
OP1460,Assess model security and vulnerability
OP1461,Attest model robustness to attacks
OP1463,Determine artifacts (evidence) required to explain model decisions
OP1464,Collect evidences for explainable decision
OP2386,Create an explanation/interpretation taxonomy
OP2449,Identify model variables that influence explainability
OP2450,Define metrics and measures for monitoring explainability 
OP2387,"Establish requirements for ""good"" explanations/interpretations"
OP1466,Implement explanation strategies
OP2520,Provide additional disclosure on model explainability to the users
OP2521,Assess potential model risk exposure caused by explainability
OP2522,Identify root-causes of explainability issues
OP2523,Resolve root-causes of explainability issues
OP1467,Audit explainability of AI models
OP1468,Record model design & model development methodology
OP1469,Record rule logic used by model
OP1470,Explain rule design for risk mitigation
OP1471,Record risks & limitations to selected rules and/or design approach
OP1472,Record alternative model design approaches that were considered
OP1473,Monitor model documentation
OP1474,Implement model reporting mechanisms
OP1475,"Select features, attributes, and models"
OP1476,Conduct repeatability assessments for commercial deployments
OP1477,Test counterfactual fairness
OP1478,Define repeatability strategies in enterprise policy
OP1479,Implement repeatability strategies
OP1480,Conduct periodic audit of repeatability of AI model
OP1481,Assess context sensibility in AI model's decision-making
OP1482,Enhance accessibility to replication files for the independent verification team
OP1483,Identify features requiring external reproducibility testing
OP1484,Employ independent teams to assess model reproducibility
OP1485,Create an audit trail to document AI processes
OP1486,Implement black box recorder 
OP1487,Identify data relevant to traceability
OP1488,Define retention periods for traceability data relevant to the industry
OP1489,Implement appropriate storage methods for traceability data 
OP1490,Assess model traceability needs
OP1491,Define traceability strategies in enterprise policy
OP1492,Implement traceability strategies
OP1493,Periodically audit the traceability of AI model
OP1494,Demonstrate the traceability for AI system informing significant decisions
OP2539,Define scope and requirements of accessibility in the project context
OP2540,Establish accessibility incidents reporting guidelines and mechanisms
OP2541,Designate responsible individual(s) for accessible design oversight
OP2545,Evaluate compliance with the established accessibility requirements
OP1495,Attest that group information is not applied to individuals 
OP1805,Document requirements for peer review of model
OP1812,Define peer review procedures for automated decision systems  
OP1813,Review automated decision system by appropriate qualified expert(s)
OP2608,Review automated decision system by two appropriate qualified experts
OP2298,Publish system specifications in peer-reviewed journal
OP2609,Address gaps identified and reported during the peer review
OP1496,Publish outcome of peer review
OP1497,Define auditability strategies in enterprise policy
OP1498,Implement auditability strategies
OP1499,Establish comprehensive record of data management practices
OP1500,Conduct periodic audit of auditability of the AI system
OP1501,"Define metrics for model reliability, performance & quality"
OP2467,Define quality requirements and criteria for the model
OP2468,Define Model Quality Indicators  
OP2470,Define Model Quality decision control points  
OP2469,Validate and approve Model Quality Indicators
OP1502,Detect production readiness
OP1503,"Review reliability, performance, and quality metrics periodically"
OP2471,Validate model quality decision control points
OP2575,Validate model performance against ground truth
OP2472,Implement model quality decision control points
OP2283,Define root-cause analysis processes for model performance
OP2284,Analyze the datasets effect on model performance
OP2285,Analyze the model parameter effect on performance
OP2286,Analyze the system configuration effect on performance
OP2576,Conduct model reliability testing
OP2287,Document model performance root cause
OP2355,Document model performance evaluation
OP2356,Review and validate model performance
OP2275,Implement monitoring mechanisms for model's dependency changes
OP2276,Establish model's computational performance monitoring
OP2473,Establish processes to address and resolve deviations in model quality
OP2277,Establish model evaluation metrics
OP2353,Monitor and document model performance
OP2474,Implement model quality monitoring
OP2475,Conduct periodic audit of model quality decision control points
OP2476,Document model quality assessments
OP2278,Validate model evaluation metrics
OP2354,Review and approve model performance requirements
OP2477,Assess operating practices for model quality monitoring
OP2478,Validate produced model quality artefacts
OP2496,Define quality requirements and criteria for the interface
OP2497,Define guidelines and procedures to determine and specify interface quality decision control points
OP2498,Define a Interface Quality Indicators
OP2499,Define Interface quality decision control points
OP2500,Validate and approve Interface Quality Indicators
OP2501,Create an escalation process for interface quality deviations
OP2502,Validate interface quality decision control points
OP2503,Implement the interface quality decision control points
OP2504,Document interface quality evaluation
OP2505,Establish processes to address and resolve deviations in interface quality
OP2506,Document and communicate the root-cause affecting the interface's quality
OP2507,Conduct periodic audit of interface quality decision control points
OP2508,Implement interface quality monitoring
OP2509,Document interface quality assessments
OP2510,Validate produced interface quality artefacts
OP2511,Assess operating practices for interface quality monitoring
OP1504,Implement monitoring mechanisms for model performance degradation
OP1505,Process to (TBD)
OP1506,Align model testing to the production environment
OP1507,Monitor alignment between model testing and production environment
OP2336,Document model tuning and maintenance requirements
OP1508,Define procedures for regular model tuning
OP1509,Tune AI models periodically
OP2561,Test for possible fairness implications caused by model tuning
OP1510,Conduct model tuning with additional human oversight
OP1511,Record performance of regular model tuning
OP1512,Identify AI systems trained in static environment
OP1513,Assess model stability for identified systems
OP1514,Implement required adjustments to AI systems for model stability
OP1515,Assess AI system failure
OP1516,Define a strategy to ensure AI model generalizes well and fails gracefully
OP2346,Assess how the unavailability of the AI system can affect the organization (BIA)
OP2347,Establish processes to interrupt AI operation (IRP)
OP2348,Establish Business Continuity Plan (BCP)
OP1517,Define a contingency plan in case of system failure
OP1818,Establish backup systems in case of failure
OP2411,Establish guidelines and processes to decommission the AI system
OP1518,Create a sunset plan for automated decision system
OP1397,Integrate AI risk management in AI design processes (not specific enough)
OP1398,Integrate Ethical risks in design and use of automated decision systems (not specific enough)
OP1399,Integrate AI risk management into existing compliance programs
OP1400,Conduct external review of AI risk management framework
OP2581,Define project accountabilities for risk management
OP1862,Integrate AI risk management in project plan (not specific enough)
OP1863,Review and approve AI risk structure
OP1879,Define de-risking strategy
OP1864,"Review and approve AI Risk ""de-risking"" strategy"
OP2412,Produce a data & analytics risk report
OP1837,Identify AI protection laws and regulations applicable to the project
OP1838,Identify legal requirements related to the design / usage of AI / Analytics
OP2587,Validate legal requirements related to the design / usage of AI / Analytics
OP1839,Assess the alignment of enterprise policies with AI/AA requirements
OP1840,Resolve gaps between enterprise policies and AI / AA requirements
OP1841,Define monitoring activities to comply with AI / AA requirements  
OP1842,Identify the artifacts required to demonstrate compliance
OP2610,Collect the artifacts required to demonstrate compliance
OP2611,Conduct periodic audit of collected artifacts required to demonstrate compliance
OP2401,Monitor project compliance to AI/AA laws & regulations
OP1843,Monitor for new or amended AI / AA laws and regulations 
OP1844,Define review trigger based on new or amended AI / AA laws and regulations
OP1845,Update enterprise AI/AA policies to align with new or amended laws and regulations
OP2388,Establish Legal Risk Management processes and guidelines based on organisational policy
OP2389,Scan legislation and policies for potential legal risks as per the context of the project
OP1544,Assess legal risks
OP1382,Assess compliance to legal requirements
OP2390,Document and record the Legal Risk Assessment outcomes
OP2391,Communicate and report key LRM issues to senior management and other stakeholders
OP2392,Establish a legal risk mitigation strategy
OP2393,Validate and approve Legal Risk mitigation strategy
OP2394,Appoint a legal advisor for the project
OP2398,Define adequate provisions for possible disputes/litigations
OP2399,Secure adequate provisions for possible disputes / litigations
OP2550,"Establish a ""due diligence"" registry"
OP2396,Implement the established plans and roadmap to prevent or mitigate adverse impacts
OP2580,Establish guidelines to identify and assess actual and potential adverse impacts in the context of the project
OP2552,Establish an organizational IP strategy
OP2553,Identify the most suitable IP rights to protect the AI product and/or service
OP2554,Secure proper Intellectual Property rights protection
OP2555,Establish detailed contractual restrictions on use of the AI
OP2556,Attest the authorisation for the usage of IP protected data by the AI application
OP2557,Validate that autonomously generated work by the AI application does not infringe IP rights
OP1383,"Monitor changes in external laws, policies, and guidelines"
OP1384,Trigger review of alignment between ethical operating procedures and amended laws and regulations
OP1385,Update ethic/fairness policies to align with modified laws or regulations
OP1386,Communicate modification of ethic/fairness policies to relevant stakeholders
OP2535,Define targeted sustainability requirements and goals of the project
OP2536,Define key activities for achieving the sustainability goals
OP2537,Establish sustainability key metrics and measures
OP2538,Deploy sustainability oversight and reporting mechanisms
OP1401,Continually identify risks relevant to AI solution (Not specific enough)
OP1402,Assess risks associated with each deployment stage of AI / automated decision system
OP1403,Define mitigation plans against identified data & analytics risks
OP1404,Monitor risks relevant to AI solution
OP2415,Periodically review data and analytics risks and mitigation
OP2414,Periodically review ethical risks and mitigation
OP1387,Identify potential negative impacts resulting from poor system design &/or usage
OP2406,Record and document risk-benefit tradeoff for decisions
OP1388,Establish safeguards to address risks related to poor system design &/or usage
OP2429,Develop a well-being indicators dashboard
OP2423,Define and establish a D&A risk impact assessment baseline
OP2424,Establish the D&A risk impact assessment strategy
OP2425,Conduct human well-being impact assessment
OP1390,Assess probability and severity of harm of AI usage
OP2426,Evaluate and document the results of the impact assessment
OP1391,Periodically review the probability and severity of harm
OP1392,Attest that probability-severity of harm assessment is periodically performed
OP1393,Review and make decisions on probability-severity of harm assessment
OP2427,Approve the impact assessment
OP2428,Communicate the results of the impact assessment
OP1394,Define accepted risks related to AI/automated decision system(s)
OP2407,Establish risk appetite and risk tolerance thresholds
OP1395,Validate risk acceptance by top management
OP2558,Document and communicate unmitigated risks to internal stakeholders
