New Code,OP
OP2644,Monitor compliance to the Directive on Open Government
OP2186,Define Open Data scope  
OP2370,Define Open Data scope and requirements in project context  
OP2187,Define Open Information scope  
OP2829,Define guidelines and procedures for the monitoring of Open Data Portal
OP2772,Monitor Open Government Portal resource page
OP2767,Identify high value data to be released (enterprise)
OP2768,Identify high value data to be released (programs/sectors)
OP2641,Assess priority for the release of data
OP2769,Assess readiness of data to be released
OP2877,Assess appropriateness to release / publish data
OP2878,Attest to the appropriateness of the data being released / published
OP2637,Define conversion protocol(s) for data and information identified for release
OP2770,Validate the eligibility of data for release (programs/sectors)
OP2796,Provide support LoB in validating eligibility of data for release
OP2188,Define accessible and reusable formats for Open Data
OP2189,Format open data and information
OP2830,Validate conformity to criteria for publication / release of data (Open Government Portal)
OP2833,Validate conformity to criteria for publication / release of data (Except Open Government Portal)
OP2831,Define criteria for the release of data on Open Government Portal
OP2832,Define criteria for the release of data on non-OG platforms
OP2823,Review and decision on data for release (Open Government)
OP2824,Review and decision on data for release (Non-Open Government)
OP2825,Submit request for OG publication
OP2826,Submit request for non-OG publication
OP2867,Submit request to be exempted of publishing on the Open Government Portal
OP2868,Review and decision on Open Government Portal examption requests
OP2190,Publish data on the Open Government Portal
OP2828,Publish data on publication platforms (except Government Portal)
OP2834,Expose metadata of released / published data to internal and external stakeholders
OP2771,Define Data Lifecycle Agreement for data to be released
OP2773,Update released data as per Data Lifecycle Agreement
OP2921,Make data and information discoverable through the open government portal
OP2846,Define clear roles and responsibilities for the released / published data
OP2840,Identify legal requirements related the data being released or published
OP2841,Attest to the legality of the release / publication of data
OP2842,Analyse contractual requirements regarding data being released or published
OP2843,Attest that the organization has the permission to release or publish a dataset
OP2876,Attest that the release / publishing is compliant to policies and directives
OP2894,Establish criteria to determine when to reuse or acquire new data to support departmental program or service
OP2895,Establish data sharing protocols in alignment with Open Government and digital standards
OP2850,Request documentation from data provider
OP2851,Review and validate data provider's documentation
OP2852,Confirm rights to use externally sourced data
OP2631,"Define guidelines, procedure and templates for the creation of data sharing agreements"
OP1982,Draft data sharing agreements
OP1983,Establish DSA review and update process
OP2090,Approve the data sharing agreements
OP2091,Validate fit-for-purpose data
OP1984,Monitor adherence to data sharing agreements
OP2801,Communicate data sharing agreement to the commission
OP2802,Communicate non-adherence to data sharing agreement to the commission
OP2815,Communicate data sharing agreement to regulatory stakeholders
OP2816,Publish a summary of data sharing agreement
OP2822,Establish a data sharing contract or agreement for PI disclosure to a third party
OP2912,Establish processes to enable data sharing and reuse
OP2913,Develop data sharing and reuse policies and procedures that align with legal and regulatory requirements
OP2914,Implement processes to enable data sharing and reuse
OP2915,Establish data sharing governance structures and decision-making processes for datasharing and reuse
OP2916,Adopt common data standards to enable effective sharing and reuse
OP2917,Establish mechanism to leverage the Canadian Digital Exchange Platform (CDXP)
OP2918,Establish inventory of common data elements for data sharing
OP2919,Leverage the Digital Exchange Community of Practice (DXCoP)
OP2920,Establish mechanism for conformity to official languages and accessibility requirements
OP2931,Establish secure data sharing mechanisms
OP2932,"Establish data privacy protocols for data interoperability, reuse, and sharing"
OP2933,"Establish security controls for data access and storage for data interoperability, reuse, and sharing"
OP2934,"Establish data protection measures for data interoperability, reuse, and sharing"
OP2935,Enforce quality measures for data sharing including via API
OP167,Define data literacy requirements for analytics
OP168,Define a holistic data literacy training program
OP169,Create a data literacy training program
OP170,Train project team on data literacy
OP171,Evaluate data literacy training
OP256,Establish a data quality management program
OP257,Communicate DQM function to all stakeholders
OP258,Establish a data quality training program
OP2160,Establish data quality implementation plan
OP2161,Evaluate the effectiveness of the data quality implementation plan
OP259,Define enterprise data quality role and responsibilities
OP260,Manage a corporate list of data quality stakeholders
OP261,Establish stakeholder engagement mechanisms
OP262,Assign data quality roles
OP263,Define mechanisms to review and evaluate DQM performance
OP264,Conduct periodic assessment of the performance of the data quality organization
OP265,Define a data quality management policy
OP2158,Define data quality management standards
OP2159,Define data quality management procedures
OP266,Define a data quality management strategy
OP2156,Approve the data quality strategy
OP267,Periodically review DQM policy and strategy
OP268,"Communicate DQ policy, strategy, standards and procedures"
OP2157,Evaluate the effectiveness of the data quality strategy
OP2627,Define guidelines to assess the reliability of data sources
OP2998,"Establish and execute processes to validate, review, and approve data quality to meet operational needs."
OP2999,Create data quality review and validation processes
OP3000,Establish guidelines and measures for monitoring data quality
OP269,Identify in-scope data quality industry standards
OP270,Resolve gaps between enterprise policies and data quality industry standards
OP271,Align enterprise policies with data quality industry standards
OP272,Demonstrate compliance with enterprise policy and data quality standards
OP273,Define business and technical data quality dimensions
OP274,Define labelling standards 
OP275,Define enterprise standards and requirements for data entry controls
OP276,Map DQM Prodago Operating Practices to organizational policies and standards
OP277,Periodically review mapping of Prodago DQM Operating Practices to organizational policies and standards
OP278,Map DQM operating practices to corporate project deliverables
OP279,Map DQM operating practices to analytics processes
OP280,Create an Enterprise RACI for DQM operating practices
OP2317,Create a project RACI for data quality management
OP281,Define audit/assessment methodology DQM operating practices
OP282,Self assess DQM operating practices by a project
OP2314,"Attest that the DQ artefacts required for audit have been produced, approved and published"
OP283,Conduct formal audit of DQM operating practices
OP284,Plan and prioritize DQM operating practices improvements
OP285,Execute DQM operating practices implementation or improvements initiatives
OP286,"Design and implement DQM operating practices metrics, reports, and dashboards"
OP287,Monitor DQM operating practices
OP288,Define enterprise data quality risk tolerance 
OP289,Approve the data quality Risk Tolerance Statement
OP290,Communicate data quality risk tolerance statement to the organization
OP291,Audit compliance to data quality risk tolerance statement periodically
OP292,Define data quality risk assessment guidelines and procedures
OP293,Define enterprise data quality risks taxonomy
OP295,Communicate data quality risk framework
OP296,Define triggering factors leading to reassessment of data quality risks
OP297,Define triggering factors leading to review of data quality risk framework
OP298,Train personnel on data quality risk assessment
OP299,Periodically review data quality risks framework
OP300,Define user permissions for data quality risk register
OP301,Define guidelines and procedures for the data quality risk register
OP302,Periodically review data quality risks and mitigation
OP303,Define data quality risks assessment scope
OP304,Assess and document data quality risks
OP305,Re-assess risks based on triggering factors
OP306,Categorize data quality risks in register
OP307,Evaluate the data quality risk assessment process
OP294,Define controls and metrics to measure data quality risks
OP308,Define a mitigation plan for data quality risks
OP309,Communicate mitigation strategies for data quality risks to stakeholders
OP311,Update mitigation strategies based on ongoing monitoring/audit of data quality risks
OP312,Identify data quality risk reporting requirements
OP313,Define reporting and disclosure guidelines for data quality risks
OP314,Establish the data quality risk reporting structure
OP315,Produce data quality risks reports
OP316,Communicate data quality risks and mitigation to stakeholders
OP319,Monitor data quality risks
OP320,Escalate data quality risks
OP321,Monitor internal factors impacting data quality risks & factors
OP322,Monitor external factors impacting data quality risks
OP323,Monitor controls and metrics for data quality risks
OP324,Update the risk register based on ongoing monitoring of data quality risks (Triggered)
OP325,Update the risk taxonomy based on ongoing monitoring of data quality risk factors
OP326,Audit implementation and effectiveness of data quality risk mitigation strategies
OP330,"Define ""fit-for-use"" data quality requirements"
OP2299,"Define ""in the lab"" data quality requirements"
OP331,"Define ""in the field"" data quality requirements"
OP2865,Define data quality requirements
OP332,Validate data quality requirements
OP2304,"Communicate ""In the lab"" DQ requirements to data producers"
OP2306,Align data quality requirements with organizational standards
OP2154,Prioritize data quality requirements
OP333,Approve the data quality requirements by relevant stakeholders
OP334,Communicate data quality requirements to relevant stakeholders
OP335,Attest that data quality requirements have been documented and are approved
OP336,Define data discovery guidelines and procedures
OP2301,Establish model data quality assessment processes
OP337,Define data profiling (fit-for-use) guidelines and procedures
OP338,Define data quality assessment (fit-for-purpose) guidelines and procedures
OP1745,Define roles and responsibilities for data profiling
OP1746,Establish a classification schema for data profiling anomalies
OP1714,Establish provisions of training on data profiling principles
OP339,Define metadata quality assessment guidelines and procedures
OP340,Define dataset quality assessment guidelines and procedures
OP341,Conduct periodic assessment of data quality assessment processes
OP342,Define data discovery scope
OP343,Execute data discovery sessions (In the lab)
OP1622,Identify data proxies
OP345,Communicate data discovery results to relevant stakeholders
OP2628,Assess the reliability of data sources
OP346,Define data profiling scope
OP347,Establish the capability to profil data (all DQ Dimensions)
OP348,Profile in-scope data 
OP349,Analyze and interpret profiling results
OP350,Collect and historize profiling results
OP351,Communicate data quality assessment results to relevant stakeholders
OP2889,Establish processes to validate data quality from internal and third party sources
OP2760,Assess availability of data
OP2761,Validate data availability for intended purposes
OP352,Define DQ assessment scope 
OP353,Define DQ assessment parameters and assessment scores
OP1620,Assess quality of data sources (In the lab)
OP2402,Assess quality of data in targeted operational environment
OP2312,Evaluate the existing data quality against data quality requirements
OP354,Assess data quality using data profiling outputs
OP355,Assess data quality using means other than data profiling
OP356,Communicate data quality assessment results to relevant stakeholders
OP1901,Validate data quality against requirements
OP1621,Demonstrate data suitability for model
OP357,Assess metadata quality
OP358,Establish committees required to assess quality of training dataset
OP359,Assess training dataset quality
OP360,Periodically review and update the training dataset
OP2483,Define guidelines and procedures to determine and specify pipeline quality decision control points
OP2484,Validate pipeline quality decision control points
OP2485,Implement pipeline quality decision control points
OP2486,Establish processes to address and resolve deviations in pipeline quality
OP2479,Define quality requirements and criteria for the pipeline
OP2480,Define Pipeline Quality Indicators  
OP2481,Define pipeline quality decision control points  
OP2482,Validate and approve Pipeline Quality Indicators
OP2487,Document pipeline quality evaluation
OP2488,Create an escalation process for pipeline quality deviations
OP2489,Define processes for conducting root-cause analysis of pipeline quality
OP2490,Document and communicate the root-cause affecting the pipeline quality
OP2491,Conduct periodic audit of pipeline quality decision control points
OP2492,Implement pipeline quality monitoring
OP2493,Document pipeline quality assessments
OP2494,Validate produced pipeline quality artefacts
OP2495,Assess Pipeline Quality Monitoring operating practices
OP2162,Define data specifications and work instructions
OP2163,Execute Data Processing
OP369,Define formatting and cleansing requirements for operational inputs
OP370,Define guidelines and procedures to cleanse data
OP1579,Define reference data for cleansing context
OP371,Format and cleanse data (Training dataset input)
OP2403,Design and implement data formatting and cleansing processes (Operational inputs)
OP2164,Log Data Processing activities
OP372,Define data entry quality controls
OP2322,Establish guidelines to define and implement DQ control points
OP2323,Implement DQ controls at entry points into the AI system
OP373,Implement quality controls to prevent data entry errors
OP374,Define guidelines and procedures to manage data quality issues
OP375,Define procedures for managing a data quality issues repository
OP376,Define procedures to assess the impacts of data quality issues
OP377,Define procedures to assess the root causes of data quality issues
OP378,Establish data quality resolution procedures and processes
OP379,Establish a data quality issues repository
OP380,Establish a capability to track and document data quality issues
OP381,Record data quality issues in DQ issue repository
OP2405,Document data quality issues
OP382,Review and approve data issues logged into repository
OP383,Categorize data issues logged in repository
OP384,Monitor data issues logged in repository
OP385,Notify relevant data stakeholders of data issues
OP386,Re-assess impacts of data quality issues periodically
OP387,Assess and document potential impacts of data issues on model building
OP388,Assess and document potential impacts of data issues on models in production
OP390,Monitor impacts of data quality issues
OP391,Attest that data issue impacts have been assessed
OP392,Assess and document root causes of data quality issues
OP394,Report data quality root causes
OP395,Define roles and responsibilities specific to the resolution of data quality issues
OP396,Prioritize data issues to be resolved (Enterprise)
OP2197,Prioritize data issues to be resolved
OP1623,Track quality issues in model development data
OP397,Assign data quality issues for analysis & resolution
OP398,Define SLA for data quality issue resolution
OP2025,Define data quality remediation plan
OP399,Resolve data quality issues impacting a project
OP400,Report data issues resolution
OP401,Attest that data quality issues have been resolved
OP2582,Define operational data quality metrics and controls  
OP2583,Design and implement data quality metrics and controls
OP402,Define required data quality metrics
OP2300,Define model data quality metrics
OP2305,Validate model data quality metrics
OP403,Define thresholds for each data quality metric
OP404,Approve the data quality metrics and thresholds
OP406,Define processes to communicate data quality metrics and thresholds 
OP407,Develop a business case justifying data quality controls
OP408,Define and design required data quality controls
OP409,Review and approve data quality control design
OP410,Document data quality controls
OP411,Implement data quality controls in source systems
OP412,Attest that data quality controls have been built and deployed
OP413,Establish a data quality controls repository
OP2307,Establish data quality rubrics
OP414,Define guidelines and procedures to manage a data quality control repository
OP415,Define guidelines and procedures to monitor data quality 
OP416,Define escalation procedures for poor data quality
OP417,Operationalize DQ controls
OP418,Operationalize DQ metrics
OP419,Operationalize DQ issues management
OP420,Operationalize data transformation processes
OP421,Periodically review DQ assessment efficiency
OP2201,Periodically review data quality issues register
OP422,Periodically review DQ metrics & controls 
OP423,Evaluate the efficiency of data quality controls
OP1580,Monitor data quality integrity
OP424,Produce enterprise data quality dashboards
OP425,Produce periodic data quality dashboards (in context)
OP426,Execute data quality reports for all enterprise data
OP427,Execute data quality reports for specific name screening business rule
OP428,Execute quality reports on specific customer data business rules
OP429,Execute data quality reports for the TM & F Programs
OP2055,Attest that data quality is managed and adequate for the context
OP1748,Define roles and responsibilities for reference data management
OP1749,Document existing valid values
OP1750,Establish rules for new reference data values
OP1751,Assess proposed new value to reference data
OP1752,Document new value addition to reference data
OP1753,Detect unauthorized use of new reference data
OP1754,Harmonize reference data values across systems 
OP430,Define guidelines and procedures to create master data
OP431,Define master data management processes
OP432,Enterprises set standards for the definition of unique identifiers for master data
OP1757,Establish standardized values across the organization
OP1758,Establish external sources for data enrichment
OP1760,Establish a protocol to manage exceptions in the master data
OP1755,Establish identity resolution process
OP433,Resolve master data duplicates (In the field - Operational Inputs)
OP2404,Resolve master data duplicates (In the lab)
OP1576,Define a matching process within Master data
OP1577,Define survivorship process within Master Data
OP1578,Document created data within master data
OP1756,Monitor Master data management
OP2133,Define the sensitivity of the golden copy to false positive/negative
OP2134,Identify master data identifying attributes
OP2135,Map unique identifiers to physical data
OP2137,Analyze potential identifying attributes
OP2138,Standardize and cleanse data 
OP2139,Compile recordset from source systems
OP2140,Enrich records with reliable external sources
OP2141,"Establish a ""golden copy"" for master data records"
OP2142,Review and approve golden copy results
OP2143,Establish mechanism to monitor usage of golden copy
OP1759,Establish survivorship business rules
OP2144,Identify sources for master data attributes
OP2145,Assign source priorities and conditions
OP2146,Identify master records with conflicting attribute values
OP2147,Apply the attribute value conflict resolution rules
OP2148,Resolve master record with specified attribute values
OP2149,Establish mechanism to detect & report MDM exceptions
OP2150,Analyze the root cause of MDM exceptions
OP2151,Resolve master data exception
OP2152,Update MDM data processing documentation
OP2153,Update MDM/DQ exception rules
OP255,Identify and define authoritative data sources for Master data
OP1571,Identify and define authoritative data sources for Reference data
OP1572,Identify and define authoritative data sources for Transactional data
OP1573,Communicate authoritative data sources to relevant stakeholders
OP2361,Attest that authoritative data sources are being used
OP193,Assess data sources prior to usage
OP2869,Request exemption to not use authoritative data sources
OP2870,Review and make decision of authoritative source exemption
OP434,Define privacy vision and mission statement
OP435,Define enterprise privacy principles and standards
OP436,Establish privacy policy suite
OP437,Define enterprise codes of conduct to protect privacy
OP438,"Define privacy requirements for external contractors, vendors, and service providers"
OP439,Approve the enterprise privacy policies and procedures
OP2595,Define enterprise confidentiality policy for personal information
OP440,Communicate enterprise privacy policies
OP441,Publish privacy policy suite on website
OP442,Develop a privacy program
OP2620,Create an enterprise privacy accountability matrix (RACI)
OP443,Identify a privacy program sponsor or “champion”
OP444,Allocate an appropriate budget and resources
OP445,Designate one or more individuals to be responsible for privacy-related obligations
OP446,Establish a committee on the protection of personal information
OP2590,Establish a committee on the access to information and protection of personal information
OP447,Establish a committee on access to information
OP448,Establish the privacy program reporting structure
OP449,"Establish a review & approval process when designing new initiatives, services, or programs using personal data"
OP450,Assistance with building privacy requirements into a project to help reduce risks
IR,Assistance with the development of privacy-related processes
OP451,Assistance with the development of privacy-related processes
OP452,Develop capabilities to ensure privacy-related processes and privacy requirements are followed
OP453,Define privacy program controls
OP454,Define privacy program metrics
OP455,Monitor and report privacy incidents and data subject requests
OP456,Periodically review privacy management guidelines and procedures
OP457,Demonstrate effective monitoring of privacy requirements
OP2625,Define guidelines to inform stakeholders about PI usage and risks
OP458,Choose enterprise privacy risk model
OP459,Define enterprise privacy risk taxonomy
OP460,Define privacy risk assessment process
OP461,Design privacy risks reporting template
OP462,Periodically review privacy risk management guidelines and procedures
OP463,Define enterprise appetite to privacy risks
OP464,Approve the Privacy Risk Appetite Statement
OP465,Communicate Privacy Risk Appetite Statement to personnel
OP466,Audit compliance to Privacy Risk Appetite periodically
OP467,Define user permissions for privacy risk register
OP468,Define guidelines and procedures for the privacy risk register
OP469,Document and categorize privacy risks in register
OP470,Periodically review privacy risks and mitigation
OP471,Conduct periodic assessment of privacy risks in each business line
OP472,Identify privacy risks in projects
OP473,Define triggering factors leading to reassessment of privacy risks
OP474,Re-assess privacy risks based on triggering factors (Triggered)
OP475,Manage the privacy risks register
OP476,Attest that privacy risks have been identified and scored
OP477,Define mitigation plan for privacy risks
OP478,Implement a privacy risks mitigation strategies (Not specific enough)
OP479,Communicate privacy risks and their mitigation strategies to key stakeholders
OP481,Define reporting and disclosure guidelines for privacy risks
OP482,Produce privacy risks reports (Enterprise)
OP483,Communicate privacy risks to internal stakeholders (Enterprise)
OP2362,Produce privacy risks reports
OP2363,Communicate privacy risks to stakeholders (Project)
OP2052,Approve that residual privacy risks are acceptable
OP484,Monitor privacy risks on an ongoing basis
OP485,Define guidelines to escalate privacy risks 
OP486,Escalate privacy risks
OP487,Monitor internal & external factors impacting privacy risks
OP488,Monitor internal & external factors impacting privacy risks
OP489,Update the risk register based on ongoing monitoring of privacy risk factors (Triggered)
OP490,Audit implementation and effectiveness of risk responses
OP491,Identify privacy and data protection laws and regulations
OP492,Identify legal requirements related to personal information 
OP2364,Identify privacy and data protection laws and regulations applicable to the project
OP2365,Identify legal requirements related to personal information (Project)
OP552,Identify project obligations and requirements related to data subject rights and requests
OP493,Resolve gaps between enterprise policies and privacy obligations
OP494,Demonstrate that data processing is aligned with privacy regulations
OP495,Align enterprise policies with privacy obligations
